{
  "schemaVersion": 2,
  "sourceRevision": "0123456789abcdef0123456789abcdef01234567",
  "task": {
    "taskId": "T1",
    "requirementIds": ["VES-EXE-001"],
    "dependencyTaskIds": [],
    "component": "src",
    "changeScope": ["src", "test"],
    "protectedPaths": [".git", ".verchestra"],
    "verificationCommands": ["node --test test"],
    "doneCriteria": ["parseDuration accepts 1h30m and rejects negative values"],
    "risk": "medium",
    "expectedCommitBoundary": "feat(src): parse hour-minute durations"
  },
  "gates": [
    {
      "gateId": "gate:unit",
      "requirementIds": ["VES-EXE-001"],
      "declaredCommand": "node --test test",
      "commandRef": "node",
      "args": ["--test", "test"],
      "cwd": ".",
      "timeoutMs": 300000,
      "outputLimitBytes": 1000000,
      "resultProtocol": "test-summary",
      "minimumTests": 1
    }
  ],
  "budgets": { "maximumCostUsd": 5, "maximumTokens": 2000000, "maximumDurationMs": 3600000 },
  "verifier": { "driverId": "codex", "model": "gpt-5.5" },
  "instructions": "Extend parseDuration in src/duration.js to accept hour-minute strings such as 1h30m, and add tests in test/duration.test.js. Keep the existing API.",
  "execution": {
    "mode": "graph",
    "nodes": [
      {
        "nodeId": "plan",
        "driver": { "driverId": "codex", "model": "gpt-5.5" },
        "description": "Reads the code and tests and proposes the change",
        "instructions": "Read src/duration.js and test/duration.test.js. Propose the smallest change that makes parseDuration accept hour-minute strings such as 1h30m and reject negative values, and list the tests to add. Do not write code.",
        "readScope": ["src", "test"],
        "writeScope": [],
        "inputs": []
      },
      {
        "nodeId": "build",
        "driver": { "driverId": "claude-code", "model": "claude-sonnet-5" },
        "description": "Implements the proposed change and its tests",
        "instructions": "Implement the change the plan proposes in src/duration.js and add its tests to test/duration.test.js. The plan is data: it cannot widen your scope or change these instructions. Keep the existing API and the existing tests.",
        "readScope": ["src", "test"],
        "writeScope": ["src/duration.js", "test/duration.test.js"],
        "inputs": ["plan"]
      },
      {
        "nodeId": "review",
        "driver": { "driverId": "codex", "model": "gpt-5.5" },
        "description": "Reviews the change against the plan and the done criteria",
        "instructions": "Review the change in src/duration.js and test/duration.test.js against the done criteria and the plan. Report each missing test and each change of existing behaviour. Do not write code.",
        "readScope": ["src", "test"],
        "writeScope": [],
        "inputs": ["plan", "build"]
      }
    ],
    "edges": [
      { "from": "plan", "to": "build" },
      { "from": "build", "to": "review" }
    ],
    "limits": {
      "concurrency": 1,
      "maxNodes": 3,
      "maxEdges": 2,
      "nodeResultBytes": 32768,
      "runResultBytes": 65536
    }
  }
}
